{
  "kicker": "60초 브리핑",
  "line": {
    "pre": "AI 답변, ",
    "accent": "누가",
    "post": " 검증하나"
  },
  "focus": {
    "label": "전문가 심의 플랫폼",
    "word": "HWAX",
    "caption": "질문 하나를 의사결정문으로"
  },
  "hint": {
    "text": "60초 안에 정리해 드립니다",
    "beats": [
      "문제",
      "해법",
      "근거",
      "시작"
    ]
  }
}
