{
  "kicker": "숏폼 브리핑 01편",
  "line": {
    "pre": "판단이 갈리는 ",
    "accent": "결정적 순간",
    "post": " 무엇을 믿나"
  },
  "focus": {
    "label": "다중 라운드 검증 체계",
    "word": "교차검증",
    "caption": "열네 명의 전문가가 함께 봅니다"
  },
  "hint": {
    "text": "60초 뒤 결론까지 갑니다",
    "beats": [
      "문제 인식",
      "해법",
      "실증 근거",
      "시작하기"
    ]
  }
}
